{
  "schema_version": "1.0",
  "repository": {
    "identity": "workspace://repository:test"
  },
  "session": {
    "id": "session-url-secret",
    "started_at": "2026-07-23T00:00:00Z",
    "collector_contract_version": "runtime-collector-v1",
    "profile": {
      "language": "typescript"
    },
    "environment": {
      "name": "production"
    }
  },
  "events": [
    {
      "sequence": 1,
      "timestamp": "2026-07-23T00:00:01Z",
      "dependency_kind": "requests",
      "source": {
        "kind": "node",
        "node_id": "route:users"
      },
      "target": {
        "kind": "external",
        "namespace": "https",
        "name": "https://user:fixture-secret-value@example.test/private?customer=42#details"
      }
    }
  ]
}
